Why Takaful is important for Muslim if everything that happens in this world is by the will of Allah?,"Takaful is not superseding the power or will of Allah in one  life, death or destiny (Qada and Qadar) but is achieving the pleasure of Allah who orders us to  help … one another in righteousness and piety. The main objective of Takaful is to provide a level of comfort to the participants against unexpected future risk through mutual cooperation."
There are so many types of insurance out there. Where do I start?,"In general, Life Insurance can be broadly categorized into:

1)Traditional insurance
2)Investment linked insurance
3)Medical and health insurance"
What are the key considerations in purchasing a Life Insurance policy?,"1)Risks that you wish to cover
2)Your financial goals
3)Your desired protection level
4)Your budget
5)Your risk appetite
"
What should I be aware of when I buy a  Takaful policy?,"1)Deal only with registered agents
Life insurance agents who are registered with the Life Insurance Association of Malaysia (LIAM) are required to pass a pre-contract examination that is conducted by the Malaysian Insurance Institute (MII).                                       2)Know your rights
If you intend to purchase a Life Insurance product from life insurance agents, you can ask for a copy of the insurance company’s service guide                                                                                                                                        3)Understand the product well
Do not be tempted by verbal promises or guarantees of high returns. Insist on product-related documents such as Sales Illustration, Product Disclosure Sheet and/or fund performance reports before committing to buy a  Insurance policy.                                                                                                                                                                "
"I spotted a new Life Insurance product that I like.
Can I cancel my current policy and purchase a new policy?","Since buying a Life Insurance policy is a long-term commitment, it is not advisable to terminate your policy early because the surrender value is usually less than the total premiums paid. You might also be charged with a higher premium if you purchase a new policy since you are older now"
What will happen to my Insurance policy if I fail to pay my premium on time?,"There is a grace period, which gives you an additional period of time after the premium payment due date. During this period, you can still pay your premium and your policy still continues to be in-force. Usually, you are given a grace period minimum of thirty (30) days from the Billing Date, subjected to the company practices.After 30 days,your takaful policty will void and lapse."
My certificate is lapsed. Can I reinstate my certificate?,"Yes. The reinstatement is allowed within 6 months from the lapse date. You will need to submit the reinstatement request by
completing the application form here and pay all outstanding contributions. However, the acceptance of your reinstatement
request is subject to the health underwriting at the time of your request"
"I can no longer afford to pay for my premiums or contributions, for one reason or another.
What can I do?","Speak to your servicing agent about the options available,such as :
1)Traditional Life Insurance with Cash Value
The life insurance company can often make changes to ensure that your Life Insurance policy can remain in-force without further premium payments.                                                                                                                                                 2)Investment Linked Insurance
As a portion of the premiums paid is invested into investment funds of your choice, your investment linked insurance policy will accumulate an investment value over time."
Will I get a refund if I cancel my certificate?,"If you cancel within the 15 days free-look period from the delivery of your e-Certificate, the total contribution that you have paid
will be refunded.
	 However, if you cancel after the 15 days free-look period, you will not be entitled to any refund of contribution or cash value. Your
coverage will cease on the next contribution due date where you do not require to make further contributions."
When will I receive my certificate?,"Upon your successful application with contribution payment, we will email you the e-Certificate based on the email address provided in your application form and a link to download the Certificate Wording for the terms and conditions of this plan. Y"
